{
  "$schema": "./schema.json",
  "slug": "ai",
  "title": "AI 与大模型",
  "description": "大模型、Agent、AI 编程、推理框架、开源模型的发布与落地。",
  "updatedAt": "2026-10-17T05:33:29+08:00",
  "items": [
    {
      "id": "ai-20261016-reflection-beam-weights-release",
      "title": "Reflection 开放 Beam 权重，完成从预览到可下载自托管",
      "summary": "相较 10 月 5 日仅公布预览和发布计划，Reflection 现已按 Apache 2.0 许可证开放 Beam 权重，并发布模型卡与安全技术报告。该模型为 5010 亿总参数、每 Token 激活 230 亿参数的 MoE；开发者可下载、自托管和定制，但性能数字仍主要来自厂商与合作伙伴测试。",
      "publishedAt": "2026-10-16",
      "source": "Reflection AI",
      "url": "https://reflection.ai/blog/beam-is-available",
      "subCategory": "开源模型"
    },
    {
      "id": "ai-20261016-google-autonomous-wet-lab-research",
      "title": "Google Research 公开 AI 智能体闭环湿实验室三项研究",
      "summary": "Google Research 发布 VERID 实验室数字孪生、适配体闭环发现和全新蛋白结合剂设计三项工作，用模拟校验、真实机器人实验和多轮反馈连接计算设计与湿实验。团队报告适配体命中率在识别实验伪差后回升，并得到个位数纳摩尔亲和力的蛋白结合剂；这些结果来自研究团队实验，尚非外部复现。",
      "publishedAt": "2026-10-16",
      "source": "Google Research",
      "url": "https://research.google/blog/grounding-ai-agents-in-biological-reality-building-blocks-for-autonomous-wet-labs/",
      "subCategory": "AI 科研"
    },
    {
      "id": "ai-20261015-meta-muse-spark-open-mlx",
      "title": "Meta 开放 Muse Spark 816B 权重，Apple 给出多台 Mac Studio 本地推理方案",
      "summary": "Muse Spark Open 权重已发布；Apple 的 MLX 实测列出该 MoE 模型共 8160 亿参数、每次激活 420 亿参数，4 位量化后权重约占 493GB，连同中间计算仍无法装进单台 512GB Mac Studio。官方测试中，两台和四台 M5 Ultra 在 8192 Token 上下文下分别达到每秒 15.74 和 36.73 Token；这些数字来自 Apple 指定硬件与 MLX 配置，并非独立横向评测。",
      "publishedAt": "2026-10-15",
      "source": "Apple Machine Learning Research / Meta",
      "url": "https://machinelearning.apple.com/research/mlx-distributed-inference",
      "subCategory": "开源模型"
    },
    {
      "id": "ai-20261015-anthropic-metr-embedded-evaluation",
      "title": "Anthropic 向 METR 开放近似内部风险团队权限，允许其独立发布评估",
      "summary": "Anthropic 已让 6 名 METR 员工使用公司硬件、办公空间和接近内部风险评估团队的工具权限。METR 可发布对风险、事故和实践的分析，Anthropic 不能否决发布，只能要求删去客户数据、特权信息等预先限定内容，METR 可公开质疑删减是否合理；该安排属公司自愿机制，覆盖小团队且不等同监管审查。",
      "publishedAt": "2026-10-15",
      "source": "Anthropic",
      "url": "https://www.anthropic.com/news/an-update-on-independent-evaluators",
      "subCategory": "AI 安全"
    },
    {
      "id": "ai-20261014-probabilistic-bias-correction-weather",
      "title": "Nature 论文用机器学习纠偏，将两至六周天气预测推过气候平均基线",
      "summary": "MIT、Microsoft、ECMWF 等团队提出 Probabilistic Bias Correction：不替换现有天气模型，而是学习其历史系统性误差并在输出端纠偏。作者报告该方法在两至六周预测上首次稳定超过气候平均基线，竞赛组合方案把原模型预测能力提高一倍；模型开源且推理不依赖超级计算机，但投入业务运行仍需各气象机构验证。",
      "publishedAt": "2026-10-14",
      "source": "MIT News / Nature",
      "url": "https://news.mit.edu/2026/researchers-improve-weather-forecasts-looking-two-six-weeks-out-1014",
      "subCategory": "AI研究"
    },
    {
      "id": "ai-20261013-google-gemini-4-argon-stable-api",
      "title": "Gemini 4 Argon 从受限开放转为稳定版 API",
      "summary": "Google 10 月 13 日将 gemini-4-argon 标为 Stable，并开放 AI Studio 试用；文档列出文本、图像、视频、音频和 PDF 输入，以及 1,048,576 Token 的统一输入输出窗口。相较 9 月 30 日仅向可信网络防御者开放，这次变化为开发者提供了稳定版接入入口。",
      "publishedAt": "2026-10-13",
      "source": "Google AI for Developers",
      "url": "https://ai.google.dev/gemini-api/docs/models/gemini-4-argon",
      "subCategory": "大模型"
    },
    {
      "id": "ai-20261009-china-model-safety-disclosure-study",
      "title": "研究称中国主要 AI 厂商仅 3.6% 的模型发布可匹配公开安全评估",
      "summary": "据路透社引述 SemiAnalysis 报告，研究者检查 9 家中国厂商在 2021 年至 2026 年 9 月 15 日间发布的 857 个模型，只有 31 个可匹配到公开的模型级安全评估，9 个在发布前或发布时已有结果。统计衡量的是公开披露而非是否做过内部测试，报告也未给出美国厂商的可比比例。",
      "publishedAt": "2026-10-09",
      "source": "路透社 / SemiAnalysis",
      "url": "https://www.reuters.com/legal/litigation/china-ai-developers-publish-safety-tests-just-36-model-releases-report-finds-2026-10-09/",
      "subCategory": "AI 安全"
    },
    {
      "id": "ai-20261008-google-gemini-agent",
      "title": "Google Cloud 发布 Gemini 企业代理，可持续执行任务并调度子代理",
      "summary": "Google Cloud 发布面向企业工作的 Gemini agent：它可在云端持续执行跨设备任务，连接企业系统，并按目标动态创建和协调临时子代理；同一入口还覆盖问答、内容生成与代码执行。官方公告尚未给出统一定价，也未提供独立效果验证。",
      "publishedAt": "2026-10-08",
      "source": "Google Cloud",
      "url": "https://cloud.google.com/blog/products/ai-machine-learning/welcome-to-gemini-at-work-2026",
      "subCategory": "AI应用"
    },
    {
      "id": "ai-20261007-anthropic-claude-haiku-5-5",
      "title": "Anthropic 发布 Claude Haiku 5.5，小模型加入可调推理强度",
      "summary": "Claude Haiku 5.5 已在 Anthropic API、AWS、Google Cloud 和 Microsoft Azure 上线，模型 ID 为 claude-haiku-5-5，并首次在 Haiku 系列加入可调 effort。每百万 Token 的输入与输出价格在 10 万 Token 内分别为 0.10 和 0.50 美元，超过后为 0.50 和 2.50 美元。",
      "publishedAt": "2026-10-07",
      "source": "Anthropic",
      "url": "https://www.anthropic.com/claude-haiku-5-5",
      "subCategory": "大模型"
    },
    {
      "id": "ai-20261007-openai-gpt6-intelligent-ui",
      "title": "ChatGPT 上线 GPT-6 Intelligent UI，回答可直接生成交互界面",
      "summary": "OpenAI 开始在 ChatGPT 的 Chat 标签中推送 GPT-6 与 Intelligent UI，回答可组合文字、图形、按钮、表单和交互工具，并由原生组件库和编译器边生成边渲染。Plus、Pro、Business 和 Enterprise 当日开始上线，Free 与 Go 次日开始；本次更新不改变 Work 与 Codex 使用的模型。",
      "publishedAt": "2026-10-07",
      "source": "OpenAI",
      "url": "https://openai.com/index/gpt-6-for-everyone/",
      "subCategory": "AI应用"
    },
    {
      "id": "ai-20261006-mistral-large-4-preview",
      "title": "Mistral Large 4 开放公测 API，权重计划月底发布",
      "summary": "Mistral 开放 Large 4 公测 API；该多模态 MoE 模型支持代码、工具调用和 Agent 工作流，官方文档列出 100 万 Token 上下文及每百万 Token 1.36 美元输入、4.18 美元输出价格。模型权重、更多架构细节和训练方法尚未发布，厂商计划在本月底补齐。",
      "publishedAt": "2026-10-06",
      "source": "Mistral AI",
      "url": "https://mistral.ai/news/mistral-large-4/",
      "subCategory": "大模型"
    },
    {
      "id": "ai-20261005-reflection-beam-preview",
      "title": "Reflection 预览 5010 亿参数 Beam，权重与技术报告尚未发布",
      "summary": "Reflection 公布稀疏 MoE 模型 Beam，称其总参数 5010 亿、每 Token 激活 230 亿，并用 10500 块 NVIDIA GB300 完成逾 1 亿次强化学习 rollout。模型仍在最终红队测试和评估，当前仅开放候补申请；权重、模型卡、技术报告及开发者工具计划本月稍后发布，性能数据也仍主要来自厂商评测。",
      "publishedAt": "2026-10-05",
      "source": "Reflection AI",
      "url": "https://reflection.ai/blog/introducing-beam",
      "subCategory": "开源模型"
    },
    {
      "id": "ai-20261005-openai-gpt-rosalind-pricing",
      "title": "GPT-Rosalind 研究模型 10 月 5 日起计费，访问仍限获批机构",
      "summary": "OpenAI 的定价页显示，gpt-rosalind-research 自 10 月 5 日起开始计费：每百万 Token 的输入、缓存输入和输出价格分别为 5 美元、0.5 美元和 25 美元。该模型仍只通过可信访问计划向获批机构的内部研究开放，且不适用缓存写入计价。",
      "publishedAt": "2026-10-05",
      "source": "OpenAI",
      "url": "https://developers.openai.com/api/docs/pricing#specialized-models",
      "subCategory": "行业应用"
    },
    {
      "id": "ai-20261001-strands-decider-2b",
      "title": "Strands 开源 Decider 2B，以单次前向计算为 Agent 做选择",
      "summary": "Strands 开源 Decider 2B：它以 Qwen3.5-2B 为底座，移除文本生成头并换成选项评分头，可用一次前向计算完成是非、选项和评分任务，适合工具选择与参数校验。项目公布的约 115 毫秒中位延迟来自 RTX 3090 测试，JevBench 结果也不足以代表所有真实任务。",
      "publishedAt": "2026-10-01",
      "source": "Strands Agents",
      "url": "https://strandsagents.com/blog/introducing-strands-decider/",
      "subCategory": "开源模型"
    },
    {
      "id": "ai-20260930-google-gemini-4-argon",
      "title": "Google 公布 Gemini 4 Argon，首批仅向可信网络防御者开放",
      "summary": "Google 公布 Gemini 4 Argon，主打长流程编程、知识工作和网络防御，输出上限从 64K 扩至 100 万 Token；首批仅通过 Fairwind 向可信网络防御者开放，面向开发者和消费者的广泛发布尚无明确日期。发布页的基准与内部案例均属厂商数据。",
      "publishedAt": "2026-09-30",
      "source": "Google",
      "url": "https://blog.google/innovation-and-ai/models-and-research/gemini-models/gemini-4-argon/",
      "subCategory": "大模型"
    },
    {
      "id": "ai-20260929-anthropic-glm-5-3-cyber-evaluation",
      "title": "Anthropic 测试称 GLM-5.3 已具备端到端漏洞利用能力",
      "summary": "Anthropic 在隔离环境中测试称，GLM-5.3 在 ExploitBench 的 410 次尝试中完成 50 次端到端利用，简单诱导或修改权重也可明显绕过拒答。结果来自竞争厂商，且部分为内部或模拟基准，仍需结合独立评估解读。",
      "publishedAt": "2026-09-29",
      "source": "Anthropic Frontier Red Team",
      "url": "https://www.anthropic.com/research/glm-5-3-and-the-spread-of-advanced-cyber-capabilities",
      "subCategory": "AI 安全"
    },
    {
      "id": "ai-20260929-nvidia-kumo-tabular",
      "title": "NVIDIA 发布 Kumo Tabular，用一次前向计算完成表格预测",
      "summary": "NVIDIA 发布三档 2800 万至 2.15 亿参数的 Kumo Tabular，面向表格分类与回归，可依据带标签样本直接预测，无需逐任务训练；代码与权重按 OpenMDW 1.1 提供。四项榜单领先为厂商自测，且原生仅处理数值和类别列。",
      "publishedAt": "2026-09-29",
      "source": "NVIDIA / Hugging Face",
      "url": "https://huggingface.co/blog/nvidia/kumo-tabular",
      "subCategory": "机器学习"
    },
    {
      "id": "ai-20260928-claude-sonnet-5-5-github-copilot",
      "title": "Claude Sonnet 5.5 在 GitHub Copilot 全面可用",
      "summary": "GitHub 将 Claude Sonnet 5.5 向 Copilot Pro、Pro+、Max、Business 和 Enterprise 用户开放，覆盖 IDE、CLI、Coding Agent 与移动端，并采取渐进式推送。GitHub 称其早期测试使用的步骤、Token 和工具调用少于 Sonnet 5，但这不是独立性能验证。",
      "publishedAt": "2026-09-28",
      "source": "GitHub Changelog",
      "url": "https://github.blog/changelog/2026-09-28-claude-sonnet-5-5-in-github-copilot/",
      "subCategory": "AI 编程"
    },
    {
      "id": "ai-20260925-claude-nine-loop-amplitude",
      "title": "Anthropic 披露 Claude 参与完成九圈散射振幅计算",
      "summary": "Anthropic 9 月 25 日披露，研究人员借助 Claude Science 按已有方法算出特定理论中的九圈六粒子散射振幅，物理学家 Lance Dixon 对结果进行了核验；另有团队同期算出相关结果。这展示了 AI 组织长时间专业计算的潜力，但不能据此推断其能普遍独立发现新物理规律。",
      "publishedAt": "2026-09-25",
      "source": "Anthropic Science",
      "url": "https://www.anthropic.com/research/yes-claude-can-do-nine-loops",
      "subCategory": "AI 科研"
    },
    {
      "id": "ai-20260925-rope-override-engine-mismatch",
      "title": "社区测试指出 vLLM 与 SGLang 的 RoPE 启动覆盖可能静默改变模型配置",
      "summary": "一项带脚本和原始结果的社区测试称，在 Transformers v5 下通过启动参数覆盖 rope_scaling 时，部分模型的 rope_theta 可能丢失并回退到错误值，输出仍流畅但评测下降。相关 vLLM 与 SGLang 问题仍处开放状态，尚不能视为项目方已确认或已修复。",
      "publishedAt": "2026-09-25",
      "source": "Hugging Face Community",
      "url": "https://huggingface.co/blog/wwoosshh/entail",
      "subCategory": "推理框架"
    },
    {
      "id": "ai-20260925-github-agentic-autofix-memory",
      "title": "GitHub Agentic Autofix 接入 Copilot Memory 复用安全修复经验",